topic,primary_keyword,secondary_keywords,word_count,status
Best Trail Running Shoes for Beginners,best trail running shoes beginners,beginner trail shoes 2025 best trail shoes under 150,1800,published
Hoka Speedgoat vs Altra Lone Peak,hoka speedgoat vs altra lone peak,speedgoat 6 review altra lone peak 5 review which is better for ultras,1600,published
Best Trail Running Shoes Under $150,best trail running shoes under 150,affordable trail shoes budget trail running shoes cheap trail shoes,1600,published
Salomon vs Hoka for Ultramarathons,salomon vs hoka ultramarathon,salomon ultra glide vs hoka speedgoat trail shoe comparison,1500,published
Zero Drop Shoes for Ultramarathons,zero drop shoes ultramarathon,altra zero drop trail shoes beginners zero drop transition,1500,published
How to Choose Trail Running Shoes,how to choose trail running shoes,trail shoe buying guide fit stack drop lug pattern,1800,published
Best Wide Toe Box Trail Running Shoes,best wide toe box trail running shoes,altra wide toe box altra superior lone peak wide fit trail shoes,1600,published
Trail Running Shoes vs Road Running Shoes for Ultras,trail shoes vs road shoes ultramarathon,can you run trail ultra in road shoes trail vs road shoe differences,1500,published
How Long Do Trail Running Shoes Last,how long do trail running shoes last,trail shoe lifespan when to replace trail shoes miles on trail shoes,1400,published
Best Trail Running Shoes for Rocky Terrain,best trail running shoes rocky terrain,best trail shoes technical terrain scrambling rocky trails,1600,published
Hoka Challenger vs Speedgoat,hoka challenger vs speedgoat,challenger atr speedgoat differences which hoka for trails,1500,published
Best Waterproof Trail Running Shoes,best waterproof trail running shoes,gore-tex trail shoes waterproof trail running wet conditions,1600,published
How to Train for Your First 50K,how to train for your first 50k,50k training plan beginners first ultramarathon training,2000,published
16 Week 50K Training Plan for Beginners,16 week 50k training plan,50k training schedule beginner ultramarathon plan printable,2000,published
How Many Miles Per Week for Ultra Training,how many miles per week ultramarathon training,weekly mileage 50k training base building ultra mileage,1600,published
Back to Back Long Runs Explained,back to back long runs ultramarathon,double long run weekend ultra training why back to back,1500,published
How to Build Your Base for Ultramarathons,how to build base for ultramarathon,base building ultra running aerobic base training,1800,published
Ultra Training for People with Full Time Jobs,ultra training full time job,ultramarathon training busy schedule work life training balance,1600,published
Walk Run Strategy for Ultramarathons,walk run strategy ultramarathon,run walk method ultra running when to walk ultras,1500,published
How to Taper for an Ultramarathon,how to taper for an ultramarathon,ultra taper week pre race week training reduction 50k taper,1600,published
Strength Training for Ultra Runners,strength training ultra runners,gym workouts ultra runners best strength exercises trail running,1800,published
How to Recover After a Long Training Run,how to recover after long run,post long run recovery ultra training recovery tips,1500,published
Night Running Training Tips,night running ultramarathon training,training at night headlamp running 100 miler night section prep,1400,published
Hill Training for Ultramarathons,hill training ultramarathon,uphill running training power hiking hills ultra,1600,published
Best Hydration Vests for Beginners,best hydration vests beginners,best hydration vest 50k beginner running vest vs pack,1800,published
Ultimate Ultra Running Gear Checklist,ultra running gear checklist,complete gear list ultramarathon 50k gear checklist mandatory gear,2000,published
Best Trekking Poles for Ultramarathons,best trekking poles ultramarathon,hiking poles trail running poles ultra running poles review,1600,published
GPS Watches for Ultra Runners,best gps watch ultra runners,garmin vs coros ultra running watch long battery gps watch,1800,published
What to Wear for a 50K Race,what to wear 50k race,race day clothing ultra running outfit gear 50k,1600,published
Best Headlamps for Trail Running,best headlamp trail running,headlamp review ultra running night running lighting,1600,published
Ultra Running Nutrition Gear Guide,ultra running nutrition gear,hydration pack nutrition vest soft flask bottles trail running,1500,published
Best Running Packs Under $100,best running packs under 100,budget hydration vest running pack affordable vest,1600,published
Mandatory Gear for Ultramarathons,mandatory gear ultramarathon,required gear ultra race mandatory kit list 50k,1500,published
Best Socks for Ultramarathons,best socks ultramarathon,trail running socks blister prevention injinji darn tough,1600,published
Chafe Prevention Gear Guide,chafe prevention ultra running,anti chafe running bodyglide squirrel nut butter ultra chafe,1400,published
Cold Weather Ultra Running Gear,cold weather ultra running gear,winter ultramarathon gear layering system cold trail running,1600,published
What to Expect at Your First 50K,what to expect first 50k,first 50k race day experience aid stations what happens,1800,published
How to Pace a 50K for Beginners,how to pace a 50k,50k pacing strategy beginners run walk pacing ultra,1600,published
Ultra Running Aid Station Strategy,aid station strategy ultramarathon,how to use aid stations ultra what to do aid station 50k,1500,published
How to Deal with a DNF in Ultra Running,how to deal with dnf ultramarathon,did not finish ultra running bouncing back from dnf,1500,published
Mental Strategies for Ultramarathons,mental strategies ultramarathon,mindset ultra running mental toughness dark moments ultra,1800,published
Race Week Checklist for Ultra Runners,race week checklist ultramarathon,pre race week routine checklist ultra running,1600,published
How to Crew for an Ultramarathon,how to crew ultramarathon,crewing guide ultra running what crew does aid station crew,1600,published
Best First Ultramarathons in the US,best first ultramarathons united states,beginner friendly 50k races us easy first ultra race,1800,published
Ultra Running Nutrition on Race Day,ultra running nutrition race day,what to eat during 50k race day fueling strategy ultra,1800,published
How to Finish a 50K When You Want to Quit,how to finish 50k when you want to quit,mental strategies quitting ultra dark moments persistence,1600,published
Post Race Recovery for Ultramarathons,post race recovery ultramarathon,50k recovery plan after ultra race how to recover,1500,published
What I Wish I Knew Before My First Ultra,what i wish i knew first ultramarathon,beginner ultra running lessons learned first 50k mistakes,1800,published
Tailwind vs Skratch vs LMNT for Ultra Running,tailwind vs skratch vs lmnt,best electrolyte drink ultra running hydration comparison,1600,published
How to Train Your Gut for Ultramarathons,train gut ultramarathon,gut training ultra eating while running stomach issues ultra,1600,published
How Much Does Running an Ultramarathon Cost,ultramarathon cost,how much does ultramarathon cost budget ultra running expenses,1500,published
What Happens to Your Body During a 50K,what happens body during 50k,physiological changes ultramarathon body ultra distance effects,1600,published
How to Use Trekking Poles in an Ultramarathon,trekking poles ultramarathon beginner,when to use poles ultra hiking poles technique uphills,1500,published
50K vs Marathon How Hard Is an Ultra,50k vs marathon difficulty,is a 50k harder than a marathon ultra vs marathon comparison,1600,published
How to Pick Your First Ultra Distance,how to choose first ultra distance,50k vs 50 mile first ultra which distance start ultramarathon,1500,published
Road Ultra vs Trail Ultra Which Should You Do First,road ultra vs trail ultra,road ultramarathon vs trail ultra differences first ultra choice,1500,published
Running Vest vs Hydration Pack for Ultras,running vest vs hydration pack ultramarathon,vest vs pack ultra running which to choose soft flasks,1500,published
How to Prevent Blisters During an Ultramarathon,prevent blisters ultramarathon,blister prevention ultra running tape socks lube foot care,1600,published
Caffeine Strategy for Ultramarathons,caffeine ultra running,when to take caffeine ultra running caffeine strategy 100 miler,1400,published
How to Do Back to Back Long Runs,back to back long runs ultra training,double long run training tired legs practice race fatigue,1500,published
Should You Run a 50K Before a 50 Miler,should you run 50k before 50 miler,50k prerequisite 50 mile stepping stones ultra distances,1500,published
Ultra Running on a Budget,ultra running budget,cheap ultramarathon training budget gear affordable ultra running,1600,published
Best Beginner 50K Races in the US,best beginner 50k races united states,easiest 50k races us flat 50k beginner ultra races list,1800,published
What Nobody Tells You About Ultramarathons,what nobody tells you ultramarathon,honest ultramarathon truth real talk ultra running surprises,1800,published
What to Eat the Night Before an Ultra,what to eat night before ultra,pre race dinner ultramarathon pre race nutrition carb loading,1500,published
How to Set Up Your Drop Bag for an Ultra,ultra marathon drop bag,drop bag checklist what to put in drop bag ultra race,1600,published
How to Come Back After a DNF,come back after dnf ultra,dnf recovery plan ultra running second attempt after did not finish,1500,published
Gifts for Ultra Runners,gifts for ultra runners,best gifts ultra runners present ideas trail runner gifts,1600,published
Night Running Safety Tips for Trail Runners,night running safety trail,safe night trail running tips headlamp visibility running alone night,1400,published
Cross Training for Ultra Runners,cross training ultra runners,cycling swimming yoga ultra runner cross training benefits,1600,published
Signs of Overtraining in Ultra Runners,overtraining signs ultra runner,overtraining syndrome ultra running burnout symptoms training too much,1500,published
Downhill Running Technique for Ultras,downhill running technique ultra,quad-destroying downhills trail running technique descending ultras,1500,published
Best Anti-Chafe Products for Runners,best anti chafe products running,bodyglide vs vaseline vs squirrel nut butter chafe prevention,1400,published
Ultra Running Heat Training and Race Tips,ultra running heat tips,running in heat ultramarathon hot weather ultra racing tips,1600,published
Treadmill Training for Ultramarathons,treadmill ultra training,can you train for ultramarathon treadmill indoor ultra training,1400,published
How to Read a Trail Running Race Map,how to read trail race map,ultra race maps course maps navigation trail running,1300,published
Ultra Marathon Recovery Week Plan,ultra marathon recovery plan,week by week recovery after ultramarathon return to running,1600,published
Group Training for Ultra Runners,ultra running group training,running club ultra training benefits group trail running,1400,published
Homemade Race Day Nutrition for Ultras,homemade ultra running nutrition,diy race fuel home made nutrition ultra running recipes,1500,published
How to Handle a Race Being Canceled,ultra race canceled,ultramarathon canceled what to do race postponed refund options,1300,published
Ultra Running Goals for Beginners,ultra running goals beginner,setting goals first ultra running smart goals ultramarathon,1400,published
Podcasts Every Ultra Runner Should Listen To,ultra running podcasts,best trail running podcasts ultra running shows recommendations,1400,published
Cold Weather Ultra Training Guide,ultra training cold weather,winter ultra training cold running tips freezing conditions ultra,1500,published
How to Carry Water While Trail Running,how to carry water trail running,water carrying options trail running bottles vest handheld,1400,published
Race Day Nutrition Plan for a 50K,race day nutrition plan 50k,what to eat 50k race fueling plan calories per hour ultra,1800,published
Aid Station Etiquette at Ultramarathons,aid station etiquette ultramarathon,how to behave aid station ultra tips volunteers manners,1300,published
Beginner Ultramarathons in Europe,beginner ultramarathons europe,easy first ultra races europe scenic 50k beginner trail races,1600,published
What Runners Get Wrong About Ultramarathon Nutrition,ultramarathon nutrition mistakes,common nutrition mistakes ultra running fueling errors race day,1600,published
How to Train for High Altitude Ultras,high altitude ultra training,altitude running preparation acclimatization trail races elevation,1600,published
Power Hiking for Ultramarathons,power hiking ultramarathon,speed hiking ultra running technique uphill walking efficiency,1500,published
How to Manage Blisters Mid-Race,managing blisters during ultra race,blister treatment mid race ultra first aid foot care,1400,published
Sodium and Electrolyte Strategy for Ultras,sodium strategy ultramarathon,electrolytes ultra running salt tablets hyponatremia prevention,1600,published
How to Train for a 100-Mile Race,how to train for 100 mile ultramarathon,100 miler training plan first 100 mile race ultra,2000,published
The Best 100-Mile Races for Beginners,best 100 mile races beginners,easiest 100 miler first 100 mile race friendly ultras,1800,published
Ultra Running Injuries and How to Prevent Them,ultra running injuries prevention,it band shin splints plantar fasciitis ultramarathon injury prevention,1800,published
How to Find a Running Coach for Ultras,ultra running coach,finding ultramarathon coach online coaching trail running program,1500,published
Running Your First 50 Miler After a 50K,first 50 mile race after 50k,stepping up to 50 miler training for 50 miles first fifty,1800,published
Sleep Deprivation in 100 Mile Races,sleep deprivation 100 mile race,staying awake 100 miler sleep management ultra running night,1600,published
How to Choose an Ultra Race That Fits You,how to choose ultramarathon race,picking right ultra race difficulty terrain beginner fit,1600,published
Ultra Running Community How to Get Involved,ultra running community,trail running community finding running friends ultra groups,1400,published
Fueling Your First Overnight Ultra,fueling overnight ultra race,night time fueling ultra running what to eat after dark,1500,published
How Your Body Changes When You Train for Ultras,body changes ultra training,physical changes training ultramarathon transformation running body,1600,published
Pacers in Ultramarathons Everything You Need to Know,pacers ultramarathon guide,how pacers work ultra running when allowed pacer rules,1500,published
How Weather Affects Ultramarathon Performance,weather ultramarathon performance,rain mud heat cold wind ultra running race day weather,1500,published
Mindfulness and Meditation for Ultra Runners,mindfulness ultra running,meditation trail running mental health endurance sports,1400,published
How to Deal with Nausea During an Ultra,nausea during ultramarathon,stomach issues ultra running vomiting nausea fix race day,1500,published
How to Train on Hilly vs Flat Terrain,hilly vs flat ultra training,training elevation gain flat terrain ultra prep,1500,published
Ultra Running Shoe Rotation Guide,ultra running shoe rotation,rotating shoes ultra training multiple pairs trail shoes,1400,published
First Aid Kit for Ultra Runners,first aid kit ultramarathon,medical kit trail running wilderness first aid ultra race,1400,published
How to Read Your Body During an Ultra,listening to your body ultramarathon,body signals ultra running pain vs discomfort when to stop,1600,published
Post Ultra Blues and How to Deal with Them,post ultra blues,post race depression ultramarathon finishing blues what to do,1400,published
How to Pick the Right Running Vest Size,running vest sizing guide,how to fit hydration vest running vest sizing trail running,1300,published
Ultra Running Nutrition for Women,ultra running nutrition women,female athlete nutrition ultramarathon hormones fueling women,1600,published
How to Use Heart Rate Training for Ultras,heart rate training ultra running,zone 2 training ultramarathon heart rate zones ultra,1600,published
The Best Ultramarathon Books Every Runner Should Read,best ultramarathon books,ultra running books inspiration training guides memoirs trail,1400,published
How to Avoid Going Out Too Fast in an Ultra,going out too fast ultramarathon,race start pace control ultra running first miles strategy,1500,published
Trail Running Etiquette for Beginners,trail running etiquette,trail manners right of way hiking trail running courtesy,1300,published
How to Train for a Desert Ultramarathon,desert ultramarathon training,hot dry race prep heat training desert ultra survival tips,1600,published
Ultra Running and Family Life Balance,ultra running family balance,training for ultramarathon with family kids spouse support,1500,published
How to Get Sponsored as an Ultra Runner,ultra runner sponsorship,trail running sponsors brand ambassadors ultra athlete sponsorship,1400,published
Recovery Nutrition After an Ultramarathon,recovery nutrition ultramarathon,what to eat after ultra race protein carbs recovery food,1500,published
Best Foam Rollers and Recovery Tools for Runners,foam roller runner recovery,recovery tools ultra running foam roller massage gun compression,1500,published
How to Stop Comparing Yourself to Other Runners,comparing yourself to other runners,imposter syndrome ultra running comparison mindset beginner,1400,published
Visualizing Race Day Success in Ultra Running,visualization ultra running,mental rehearsal race visualization technique ultra mindset,1400,published
How to Use Poles on Technical Downhills,trekking poles downhills trail running,pole technique descending technical terrain ultra running,1300,published
Gels vs Real Food in Ultramarathons,gels vs real food ultramarathon,energy gels vs solid food ultra race nutrition strategy,1600,published
How Running Ultras Changed My Life,how ultra running changed my life,personal transformation ultramarathon life lessons endurance running,1500,published
Best Trail Running Trails in the US for Beginners,best beginner trail running trails us,easy scenic trails beginners trail running locations us,1800,published
What is Vertical Kilometer Racing,vertical kilometer race ultra,VK race vertical kilometer training tips technique,1400,published
How to Keep Running When Everything Hurts,keep running when hurting ultramarathon,pain management ultra running discomfort tolerance race day,1500,published
How to Handle Crew and Pacers at Drop Bag Points,crew pacer drop bag ultra,coordinating crew pacers ultra race logistics communication,1500,published
Ultra Running Superstitions and Pre-Race Rituals,ultra running rituals pre race,pre race routines superstitions ultra runners habits,1300,published
How to Prepare for a Multi-Day Ultra,multi day ultramarathon preparation,stage race ultra multi day race training preparation,1800,published
The Science Behind Ultra Endurance,science of ultra endurance,physiology ultramarathon human limits endurance science,1600,published
How to Train with Elevation When You Live Flat,training elevation flat terrain,simulating hills treadmill incline flat runner altitude prep,1500,published
How to Fix Tight Hip Flexors for Runners,tight hip flexors runners,hip flexor exercises ultra runners mobility hip pain running,1400,published
Best Recovery Drinks for Ultra Runners,best recovery drinks ultra runners,post run recovery drink protein shakes chocolate milk ultra,1400,published
Dealing with Fear Before Your First Ultra,fear before first ultra,race anxiety ultramarathon pre race nerves first time,1500,pending
How to Volunteer at an Ultramarathon,volunteer ultramarathon,aid station volunteer trail running event volunteering ultra,1300,pending
Ultra Running Training Log What to Track,ultra running training log,tracking runs ultra training log data mileage elevation sleep,1400,pending
How to Break in New Trail Running Shoes,breaking in trail running shoes,new trail shoe break in period blisters new shoes,1300,pending
How Altitude Affects Ultra Running Performance,altitude effects ultra running,running at altitude hypoxia performance elevation adjustment,1500,published
Best Compression Gear for Ultra Runners,compression gear ultra runners,compression socks sleeves shorts ultra recovery benefits,1400,published
How to Plan a Training Weekend for Ultras,training weekend ultra,back to back runs training camp ultra weekend planning,1500,published
Plant-Based Nutrition for Ultra Runners,plant based ultra running nutrition,vegan ultramarathon nutrition plant based athlete ultra,1600,published
How to Manage Expectations at Your First Ultra,managing expectations first ultra,realistic expectations first ultramarathon goal setting mindset,1500,published
How to Qualify for Western States 100,how to qualify western states 100,western states lottery qualifying races golden ticket,1600,published
UTMB vs Western States How They Compare,utmb vs western states,comparing utmb western states 100 hardest ultra races,1500,published
How to Train for a Rainy or Muddy Ultra,training for muddy ultra race,wet conditions trail running mud race preparation slippery trails,1400,published
Ultra Running Social Media Do's and Dont's,ultra running social media,strava garmin connect sharing runs trail running culture,1300,published
How to Stay Motivated During a Long Training Block,staying motivated ultra training,motivation ultra training burnout prevention long training cycle,1500,pending
How to Film and Document Your First Ultra,documenting first ultramarathon,filming ultra running vlog trail running content creation,1300,pending
